[
  {
    "asset_id": "SHD-001",
    "canonical_url": "https://titlechainfoundation.org/shadow/assets/SHD-001",
    "qr_png": "qr/SHD-001.png",
    "qr_svg": "qr/SHD-001.svg",
    "status": "active"
  },
  {
    "asset_id": "SHD-002",
    "canonical_url": "https://titlechainfoundation.org/shadow/assets/SHD-002",
    "qr_png": "qr/SHD-002.png",
    "qr_svg": "qr/SHD-002.svg",
    "status": "active"
  },
  {
    "asset_id": "SHD-003",
    "canonical_url": "https://titlechainfoundation.org/shadow/assets/SHD-003",
    "qr_png": "qr/SHD-003.png",
    "qr_svg": "qr/SHD-003.svg",
    "status": "active"
  },
  {
    "asset_id": "SHD-004",
    "canonical_url": "https://titlechainfoundation.org/shadow/assets/SHD-004",
    "qr_png": "qr/SHD-004.png",
    "qr_svg": "qr/SHD-004.svg",
    "status": "active"
  },
  {
    "asset_id": "SHD-005",
    "canonical_url": "https://titlechainfoundation.org/shadow/assets/SHD-005",
    "qr_png": "qr/SHD-005.png",
    "qr_svg": "qr/SHD-005.svg",
    "status": "active"
  },
  {
    "asset_id": "SHD-006",
    "canonical_url": "https://titlechainfoundation.org/shadow/assets/SHD-006",
    "qr_png": "qr/SHD-006.png",
    "qr_svg": "qr/SHD-006.svg",
    "status": "active"
  },
  {
    "asset_id": "SHD-007",
    "canonical_url": "https://titlechainfoundation.org/shadow/assets/SHD-007",
    "qr_png": "qr/SHD-007.png",
    "qr_svg": "qr/SHD-007.svg",
    "status": "active"
  },
  {
    "asset_id": "SHD-008",
    "canonical_url": "https://titlechainfoundation.org/shadow/assets/SHD-008",
    "qr_png": "qr/SHD-008.png",
    "qr_svg": "qr/SHD-008.svg",
    "status": "active"
  },
  {
    "asset_id": "SHD-009",
    "canonical_url": "https://titlechainfoundation.org/shadow/assets/SHD-009",
    "qr_png": "qr/SHD-009.png",
    "qr_svg": "qr/SHD-009.svg",
    "status": "active"
  },
  {
    "asset_id": "SHD-010",
    "canonical_url": "https://titlechainfoundation.org/shadow/assets/SHD-010",
    "qr_png": "qr/SHD-010.png",
    "qr_svg": "qr/SHD-010.svg",
    "status": "active"
  },
  {
    "asset_id": "SHD-011",
    "canonical_url": "https://titlechainfoundation.org/shadow/assets/SHD-011",
    "qr_png": "qr/SHD-011.png",
    "qr_svg": "qr/SHD-011.svg",
    "status": "active"
  },
  {
    "asset_id": "SHD-012",
    "canonical_url": "https://titlechainfoundation.org/shadow/assets/SHD-012",
    "qr_png": "qr/SHD-012.png",
    "qr_svg": "qr/SHD-012.svg",
    "status": "active"
  },
  {
    "asset_id": "SHD-013",
    "canonical_url": "https://titlechainfoundation.org/shadow/assets/SHD-013",
    "qr_png": "qr/SHD-013.png",
    "qr_svg": "qr/SHD-013.svg",
    "status": "active"
  },
  {
    "asset_id": "SHD-014",
    "canonical_url": "https://titlechainfoundation.org/shadow/assets/SHD-014",
    "qr_png": "qr/SHD-014.png",
    "qr_svg": "qr/SHD-014.svg",
    "status": "active"
  },
  {
    "asset_id": "SHD-015",
    "canonical_url": "https://titlechainfoundation.org/shadow/assets/SHD-015",
    "qr_png": "qr/SHD-015.png",
    "qr_svg": "qr/SHD-015.svg",
    "status": "active"
  },
  {
    "asset_id": "SHD-016",
    "canonical_url": "https://titlechainfoundation.org/shadow/assets/SHD-016",
    "qr_png": "qr/SHD-016.png",
    "qr_svg": "qr/SHD-016.svg",
    "status": "active"
  },
  {
    "asset_id": "SHD-017",
    "canonical_url": "https://titlechainfoundation.org/shadow/assets/SHD-017",
    "qr_png": "qr/SHD-017.png",
    "qr_svg": "qr/SHD-017.svg",
    "status": "active"
  },
  {
    "asset_id": "SHD-018",
    "canonical_url": "https://titlechainfoundation.org/shadow/assets/SHD-018",
    "qr_png": "qr/SHD-018.png",
    "qr_svg": "qr/SHD-018.svg",
    "status": "active"
  },
  {
    "asset_id": "SHD-019",
    "canonical_url": "https://titlechainfoundation.org/shadow/assets/SHD-019",
    "qr_png": "qr/SHD-019.png",
    "qr_svg": "qr/SHD-019.svg",
    "status": "active"
  },
  {
    "asset_id": "SHD-020",
    "canonical_url": "https://titlechainfoundation.org/shadow/assets/SHD-020",
    "qr_png": "qr/SHD-020.png",
    "qr_svg": "qr/SHD-020.svg",
    "status": "active"
  },
  {
    "asset_id": "SHD-021",
    "canonical_url": "https://titlechainfoundation.org/shadow/assets/SHD-021",
    "qr_png": "qr/SHD-021.png",
    "qr_svg": "qr/SHD-021.svg",
    "status": "active"
  },
  {
    "asset_id": "SHD-022",
    "canonical_url": "https://titlechainfoundation.org/shadow/assets/SHD-022",
    "qr_png": "qr/SHD-022.png",
    "qr_svg": "qr/SHD-022.svg",
    "status": "active"
  },
  {
    "asset_id": "SHD-023",
    "canonical_url": "https://titlechainfoundation.org/shadow/assets/SHD-023",
    "qr_png": "qr/SHD-023.png",
    "qr_svg": "qr/SHD-023.svg",
    "status": "active"
  },
  {
    "asset_id": "SHD-024",
    "canonical_url": "https://titlechainfoundation.org/shadow/assets/SHD-024",
    "qr_png": "qr/SHD-024.png",
    "qr_svg": "qr/SHD-024.svg",
    "status": "active"
  },
  {
    "asset_id": "SHD-025",
    "canonical_url": "https://titlechainfoundation.org/shadow/assets/SHD-025",
    "qr_png": "qr/SHD-025.png",
    "qr_svg": "qr/SHD-025.svg",
    "status": "active"
  },
  {
    "asset_id": "SHD-026",
    "canonical_url": "https://titlechainfoundation.org/shadow/assets/SHD-026",
    "qr_png": "qr/SHD-026.png",
    "qr_svg": "qr/SHD-026.svg",
    "status": "active"
  },
  {
    "asset_id": "SHD-027",
    "canonical_url": "https://titlechainfoundation.org/shadow/assets/SHD-027",
    "qr_png": "qr/SHD-027.png",
    "qr_svg": "qr/SHD-027.svg",
    "status": "active"
  },
  {
    "asset_id": "SHD-028",
    "canonical_url": "https://titlechainfoundation.org/shadow/assets/SHD-028",
    "qr_png": "qr/SHD-028.png",
    "qr_svg": "qr/SHD-028.svg",
    "status": "active"
  },
  {
    "asset_id": "SHD-029",
    "canonical_url": "https://titlechainfoundation.org/shadow/assets/SHD-029",
    "qr_png": "qr/SHD-029.png",
    "qr_svg": "qr/SHD-029.svg",
    "status": "active"
  },
  {
    "asset_id": "SHD-030",
    "canonical_url": "https://titlechainfoundation.org/shadow/assets/SHD-030",
    "qr_png": "qr/SHD-030.png",
    "qr_svg": "qr/SHD-030.svg",
    "status": "active"
  },
  {
    "asset_id": "SHD-031",
    "canonical_url": "https://titlechainfoundation.org/shadow/assets/SHD-031",
    "qr_png": "qr/SHD-031.png",
    "qr_svg": "qr/SHD-031.svg",
    "status": "active"
  },
  {
    "asset_id": "SHD-032",
    "canonical_url": "https://titlechainfoundation.org/shadow/assets/SHD-032",
    "qr_png": "qr/SHD-032.png",
    "qr_svg": "qr/SHD-032.svg",
    "status": "active"
  },
  {
    "asset_id": "SHD-033",
    "canonical_url": "https://titlechainfoundation.org/shadow/assets/SHD-033",
    "qr_png": "qr/SHD-033.png",
    "qr_svg": "qr/SHD-033.svg",
    "status": "active"
  },
  {
    "asset_id": "SHD-034",
    "canonical_url": "https://titlechainfoundation.org/shadow/assets/SHD-034",
    "qr_png": "qr/SHD-034.png",
    "qr_svg": "qr/SHD-034.svg",
    "status": "active"
  },
  {
    "asset_id": "SHD-035",
    "canonical_url": "https://titlechainfoundation.org/shadow/assets/SHD-035",
    "qr_png": "qr/SHD-035.png",
    "qr_svg": "qr/SHD-035.svg",
    "status": "active"
  },
  {
    "asset_id": "SHD-036",
    "canonical_url": "https://titlechainfoundation.org/shadow/assets/SHD-036",
    "qr_png": "qr/SHD-036.png",
    "qr_svg": "qr/SHD-036.svg",
    "status": "active"
  }
]
